Date,top_post_text,top_post_upvotes,top_post_url
2020-09-29,"$CBAT $SUNW $SPI $OXBR Y'all are missing the point. - $CBAT is going to be a great play further yet:

Their new tabless batteries hold further implications than just for EV companies like tsla, the Chinese government have been looking for alternative sources of energy storage, and will refuse to use...",4,https://www.reddit.com/r/wallstreetbets/comments/j1fmmo/cbat_sunw_spi_oxbr_yall_are_missing_the_point/
2021-01-28,Can we all take a moment and appreciate the Mods who have grinded through this and held our community together. Thank you. - ,160999,https://www.reddit.com/r/wallstreetbets/comments/l6jobf/can_we_all_take_a_moment_and_appreciate_the_mods/
2021-01-29,GME YOLO update — Jan 28 2021 - ,225870,https://i.redd.it/opzucppb15e61.png
2021-01-30,GME YOLO month-end update — Jan 2021 - ,219779,https://i.redd.it/r557em3t5ce61.png
2021-01-31,Times Square right now - ,348241,https://v.redd.it/x64z70f7eie61
2021-02-01,Drew this for you my fellow retards 💎🙌🏼 - ,171545,https://i.redd.it/h7sap8vb5qe61.jpg
2021-02-02,"Today wasn’t a bloodbath for $GME or $AMC. WE watched LITERAL insanity as Hedgies sat and traded their trash BACK and forth to each other in order to cause YOU to panic. HOLD. BUY. - DD I saw posted elsewhere: hedge funds are trying their hardest to short ladder $AMC and $GME. Just hold your stock, ...",78412,https://www.reddit.com/r/wallstreetbets/comments/lajk83/today_wasnt_a_bloodbath_for_gme_or_amc_we_watched/
2021-02-03,WSB right now - ,160422,https://i.redd.it/ptv7nhxy35f61.png
2021-02-04,"u/DeepFuckingValue is being asked to testify in the upcoming GameStop hearing. ""Diamond hands and tendies gonna enter the Congressional Record"" - ",123506,https://i.redd.it/qtmt9ovgmcf61.png
2021-02-05,"Mark Cuban said ""once the brokerage stops restricting trades, then we'll see what WSB is really made of"". Well, guess what? Robinhood has removed all restrictions. - Let's show them what we're made of: retards.",60995,https://www.reddit.com/r/wallstreetbets/comments/lcyewd/mark_cuban_said_once_the_brokerage_stops/
2021-02-06,"Listen, it’s easy - ",125893,https://i.redd.it/87u6ut6horf61.jpg
2021-02-07,I’m a paper handed bitch. But my student loans are fully paid off now - ,88897,https://i.redd.it/qrqfcgkgfzf61.jpg
2021-02-08,Wow super bowl commercial for us - ,191380,https://i.redd.it/tko5nh1qy4g61.jpg
2021-02-09,Finished my DIY project just in time for GME to 🚀🚀🚀🚀 (percentages simulated to show movement in the video) - ,106370,https://v.redd.it/5gofhjblabg61
2021-02-10,Weed about to make me a millionaire in 2021 🌳🚀🌳🚀🌳🚀 - ,108888,https://i.redd.it/2hvrl2i5wgg61.jpg
2021-02-11,Goodbye. - ,81778,https://v.redd.it/a6woupge5sg61
2021-02-12,Even the smallest shareholder can change the course of the future - PART 3 - ,42596,https://v.redd.it/69r26y7rbvg61
2021-02-13,Wallstreetbets I fucking love you - ,77380,https://i.redd.it/qzrpakn0w4h61.jpg
2021-02-14,My Awesome WSB Birthday Cake - HOLD 🤲💎🤲 - ,67586,https://i.redd.it/2p8ldxle0gh61.jpg
2021-02-15,Can anyone guess when I discovered options trading? - ,60544,https://i.redd.it/l2iqys88ahh61.jpg
2021-02-16,"Welcome, new money - ",106652,https://i.redd.it/3er0gca5aoh61.jpg
2021-02-17,"Tomorrow, live from the capitol, 2/18/21 12PM ET - ",76949,https://v.redd.it/oganlg9b51i61
2021-02-18,"Today, Interactive Brokers CEO admits that without the buying restrictions, $GME would have gone up in to the thousands - ",142003,https://v.redd.it/6v6qywrv35i61
2021-02-19,Do you think he realized it YES OR NO - ,123045,https://i.redd.it/c8rg4qcntfi61.jpg
2021-02-20,GME YOLO update — Feb 19 2021 - ,201168,https://i.redd.it/2xswz0h11ii61.png
2021-02-21,Recovery Incoming! - ,88280,https://v.redd.it/0t13ux4zuti61
2021-02-22,Retards this weekend before market opens - ,81690,https://v.redd.it/r8vhhcd3sxi61
2021-02-23,Bought a car with $GME tendies-had to say thanks - ,76250,https://i.redd.it/psk8mb3mj4j61.jpg
2021-02-24,"""Give my regards to your puppet master!"" 🐙 - ",74244,https://i.redd.it/60cyis2r7aj61.jpg
2021-02-25,"ROUND 2! We've refuelled, and now we're going to pluto 🚀🙏 - ",97071,https://v.redd.it/g8dcea3iyhj61
2021-02-26,"I don't need Fox Business to hold me accountable, but I'll take it! - ",136407,https://i.redd.it/onrq8o9ptoj61.jpg
2021-02-27,GME YOLO month-end update — Feb 2021 - ,137653,https://i.redd.it/20ro9puizvj61.png
2021-02-28,I asked my cat if I should buy or sell GME - ,105975,https://v.redd.it/cer7jxne75k61
2021-03-01,It seems like you already know where - ,80837,https://v.redd.it/1fkc75aceck61
2021-03-02,Which one of you beautiful dipshits bought $12.7 mil of GME after hours - ,56673,https://i.redd.it/047jjrw2ghk61.jpg
2021-03-03,UPDATE: $GME in full Phineas mode - ,48065,https://i.redd.it/gy7tlv01fqk61.jpg
2021-03-04,Hard hitting investigative journalism & pultizer prize winning stuff right here - ,88039,https://i.redd.it/rpn6hpydszk61.jpg
2021-03-05,Live footage of me and the guys buying the dips these days 🥴 - ,65989,https://v.redd.it/486ksfr744l61
2021-03-06,Looking at my accounts in the morning - ,85560,https://i.redd.it/ac69b8ql1al61.gif
2021-03-07,I'm a brown woman in WSB! What the heck is this article talking about?! 😂 - ,117815,https://i.redd.it/cux6mpq7wll61.jpg
2021-03-08,Diamond Hand Rocket Song - ,62270,https://v.redd.it/gchrijughpl61
2021-03-09,GME YOLO update — Mar 8 2021 - ,156015,https://i.redd.it/9jfy2u8bdvl61.png
2021-03-10,OUR SAVIOR KEEPS MAKING THE NEWS! DFV INSPIRES US ALL CUZ WE JUST LIKE THE STOCK! 🚀🙌🏼🐈 - ,98340,https://i.redd.it/f9077u8e41m61.jpg
2021-03-11,GME Today... - ,101836,https://v.redd.it/ry01zotfi9m61
2021-03-12,Shoutout to anyone and everyone putting it all on the line for a stock you’ve barely researched: - ,69152,https://v.redd.it/znck4ulx6fm61
2021-03-13,Adopted a Gorilla. - ,112603,https://i.redd.it/wzd4ifw16pm61.png
2021-03-14,A message to WSB from the Director of the Dian Fossey Gorilla Fund! - ,159094,https://v.redd.it/l3stpkyrnvm61
2021-03-15,Whats it's like checking in on WSB this weekend - ,85432,https://i.redd.it/n88jg3dqo1n61.gif
2021-03-16,"$265,000 raised so far for Dian Fossey Gorilla Fund ❤️#GMEToTheMoon #ApesStrongTogether 🍌🦍🚀🌕 - ",121846,https://i.redd.it/e2tnaniy58n61.jpg
2021-03-17,So i was reading Cramers book from 2006 XD - ,63391,https://i.redd.it/m25hro19ihn61.jpg
2021-03-18,Putting my ad blocker to good use 💎🤲 - ,89754,https://i.redd.it/hycuzfl67mn61.gif
2021-03-19,Visual representation of what happens when I buy any stock. - ,54126,https://v.redd.it/bm2x5dzi8vn61
2021-03-20,"Watching GME, waiting for it to Squeeze like: - ",59400,https://i.redd.it/1uip6jnrf1o61.gif
2021-03-21,"Me trying to ""perfectly"" time buying the dip - ",48897,https://v.redd.it/615nl9sns8o61
2021-03-22,💎 🦍🚀 - ,80373,https://i.redd.it/aztlvcad9go61.jpg
2021-03-23,Trying to time a TSLA trade - ,53864,https://v.redd.it/qqrpx54psno61
2021-03-24,GME YOLO update — Mar 23 2021 - ,122126,https://i.redd.it/1jmlo9wwiuo61.png
2021-03-25,GME YOLO update — Mar 24 2021 - ,92573,https://i.redd.it/kv66vitpn1p61.png
2021-03-26,Retard and his cat resting before they bankrupt some HFs - ,85873,https://i.redd.it/x6fx0bg8q8p61.png
2021-03-27,Some need reminding - ,67262,https://i.redd.it/rr9zhe93jep61.jpg
2021-03-28,GameStop gear going to the new home at the Children’s hospital of Atlanta Monday. POWER TO THE PLAYERS ! - ,139561,https://i.redd.it/4v4vipu0krp61.jpg
2021-03-29,Here you go apes 💎🦍 - ,62008,https://i.redd.it/wrtbe46y5yp61.jpg
2021-03-30,GAMESTOP NAMES AMAZON'S ELLIOTT WILKE AS CHIEF GROWTH OFFICER 🚀🚀🚀🚀🚀 - ,36741,https://investor.gamestop.com/news-releases/news-release-details/gamestop-appoints-chief-growth-officer
2021-03-31,The Season of Perpetual Hope - ,27910,https://v.redd.it/zhi7za8ys6q61
2021-04-01,GME YOLO month-end update — Mar 2021 - ,94965,https://i.redd.it/2hashizm7fq61.png
2021-04-02,GME YOLO update — Apr 1 2021 - ,73623,https://i.redd.it/qs5f2oeisnq61.png
2021-04-03,I forgot my contracts would be exercised instead of sold if I had the funds to purchase the stock... I now own 200 shares @ 185 - ,25841,https://www.reddit.com/gallery/min4s7
2021-04-04,The phone numbers and personal data of over 553 million Facebook users have been published online for free - ,36193,https://9to5mac.com/2021/04/03/personal-data-from-over-500m-facebook-users-leaked-online/
2021-04-05,"i'm about to YOLO my $800k life savings on starbucks gift cards, what are the tax implications ?? - hey wsb i'm going to invest my life savings in starbucks gift cards cause i think the dollar is going to go down, i plan to sell them in a couple years and make an absolute killing

what are the tax i...",47304,https://www.reddit.com/r/wallstreetbets/comments/mjy92g/im_about_to_yolo_my_800k_life_savings_on/
2021-04-06,"I built a tool for us to track US Representatives Stock Trades - Hey everyone, I am the guy who built [senatestockwatcher.com](https://senatestockwatcher.com) \- which has been really helpful for a few people and just general public knowledge overall.  


Well, I finally built a tool to do the same ...",56164,https://www.reddit.com/r/wallstreetbets/comments/mkpdr9/i_built_a_tool_for_us_to_track_us_representatives/
2021-04-07,If the SEC ever decides to do their job - ,40347,https://v.redd.it/gv8kp2viamr61
2021-04-08,Ryan Cohen to Become Chairman of the Board Following Annual Meeting - ,40458,https://investor.gamestop.com/news-releases/news-release-details/gamestop-announces-slate-director-candidates-2021-annual-meeting
2021-04-09,CHARLES KNOWS WHATS GOOD... WE DIDNT RUN AND HIDE... WE RIGHT HERE 💎🙌🏼🦍🍦🚀 - ,51168,https://v.redd.it/kdaw80nc30s61
2021-04-10,We have become fearless - ,64553,https://v.redd.it/210cos8oa6s61
2021-04-11,Joining WSB - ,56233,https://v.redd.it/2ardg76yggs61
2021-04-12,"Wall Street Bets traders are more skilled and responsible than they get credit for, a new academic study finds - ",38544,https://www.businessinsider.com/wall-street-bets-reddit-traders-more-skilled-responsible-academic-study-2021-4
2021-04-13,i did something retarded - ,79103,https://v.redd.it/dsyxkm0lrrs61
2021-04-14,"Kevin O'Leary Live Now thinks a second kick of life is coming to GameStop, says ""If I was short that stock right now I would be worried"" - ",51120,https://v.redd.it/z7bxt8lk9zs61
2021-04-15,We like the stock - ,76857,https://v.redd.it/qn59ohbvq5t61
2021-04-16,Massachusetts regulators seek to revoke Robinhood's license; brokerage sues. - ,30891,https://www.msn.com/en-us/money/news/massachusetts-wants-to-pull-the-plug-on-robinhood/ar-BB1fGAYB
2021-04-17,GME YOLO update — Apr 16 2021 — final update - ,140622,https://i.redd.it/n7m08253glt61.png
2021-04-18,Tbh I only trust retards. - ,78588,https://i.redd.it/s1bw6qiwsrt61.gif
2021-04-19,GameStop Announces Chief Executive Officer Succession Plan - ,15785,https://investor.gamestop.com/news-releases/news-release-details/gamestop-announces-chief-executive-officer-succession-plan
2021-04-20,I said I’d buy more so I did. I will buy more. - ,31441,https://i.redd.it/n4hm11holau61.jpg
2021-04-21,It’s all about perspective #lossporn - ,18689,https://i.redd.it/qqt8w6qrccu61.jpg
2021-04-22,What would you say you do here? - ,36440,https://v.redd.it/uhva8z4wmmu61
2021-04-23,[LEAKED] WSB Top Minds Developing DD - ,47833,https://v.redd.it/4ucjyollvqu61
2021-04-24,Why am I still holding? I'm an Apeman. - ,85815,https://v.redd.it/mu838r04f2v61
2021-04-25,I bought 1 share of Blockbuster🌚 - ,66524,https://i.redd.it/1v0qru8jp7v61.jpg
2021-04-26,EX-SHITADEL EMPLOYEE ON SHADY DARKPOOL ACTIVITIES - ,34594,https://v.redd.it/rs9abwsl7ev61
2021-04-27,"Markets crash every time Oreo releases an even greater-stuffed cookie - The increasingly-depraved debuts of Oreos with more stuffing indicate unstable amounts of greed and leverage in the system, serving as an immediate indicator of that the makings of a market crash are in place. Conversely, when t...",52383,https://www.reddit.com/r/wallstreetbets/comments/mzkumu/markets_crash_every_time_oreo_releases_an_even/
2021-04-28,Never bet against the doctor - ,28760,https://i.redd.it/3mboejkf2sv61.gif
2021-04-29,First time buying options be like... - ,35338,https://v.redd.it/dof49hjcu3w61
2021-04-30,For the GME GANG that bought at $480. Thank you for being our support level - ,25213,https://v.redd.it/36dt3mce08w61
2021-05-01,"GME is back on the menu, $33k YOLO. - ",2479,https://www.reddit.com/gallery/n1xp4r
2021-05-05,Get a hold of yourself Yellen - ,20976,https://v.redd.it/sb1qwh4fh7x61
2021-05-06,Monster Crash - ,53689,https://v.redd.it/shekh7yq5cx61
2021-05-07,When will the dip dip??? - ,63519,https://i.redd.it/isenlnv9ujx61.jpg
2021-05-08,Long af $BABA - ,28059,https://v.redd.it/gvif3r1u9tx61
2021-05-09,GME 2½: The smell of pointless memeing - ,16042,https://v.redd.it/wanpkctqcyx61
2021-05-10,Reviewing my GME investment - ,32959,https://v.redd.it/xiy8kdyl4ay61
2021-05-11,My portfolio the last week be like: - ,35440,https://v.redd.it/imt6y0m1ggy61
2021-05-12,Every time I follow anybody else’s trading idea - ,51664,https://v.redd.it/lfntn24xboy61
2021-05-13,Cat don't care - ,40456,https://v.redd.it/qhgai72dfqy61
2021-05-14,Red crayons are our favorite - ,53576,https://v.redd.it/a4ue541p3wy61
2021-05-15,The feeling when you have been red for so long you forget that green exists - ,21814,https://v.redd.it/uxa5fow3a3z61
2021-05-16,Can't have a conscience in the squeeze game - ,8238,https://v.redd.it/vnwn1jyuwbz61
2021-05-17,Government hates this simple tax trick - ,45122,https://i.redd.it/lenvk4bfvkz61.jpg
2021-05-18,"GameStop, AMC short sellers sit on nearly $1 billion loss. - ",62778,https://www.reuters.com/technology/gamestop-amc-short-sellers-sit-nearly-1-billion-loss-ortex-2021-05-18/
2021-05-19,The Mormon church made a 900% return on GME. Forget the moon. GME is headed to the stars aboard the LDSS Nauvoo! - ,36444,https://markets.businessinsider.com/news/stocks/mormon-church-100-billion-fund-gamestop-stock-gain-tesla-stake-2021-5-1030442617
2021-05-20,Maybe I should stop listening to myself - ,30957,https://v.redd.it/s9bdkzq0r9071
2021-05-21,PLTR Life - ,16784,https://v.redd.it/kez3l9t2wd071
2021-05-22,I can remain retarded way longer than these fools can remain solvent. - ,25566,https://i.redd.it/nbuwh2l1rj071.png
2021-05-23,Some call me a prostitute. I prefer to be called a whore. - ,30767,https://i.redd.it/spzx042hho071.jpg
2021-05-24,"When did this Subreddit become therapy? - I swear if I see one more “I invested in GME before my wife and her boyfriend left me” story I am going to shoot myself.

This subreddit is for two things: tendies and gambling

Sometimes we gain them and sometimes we lose ‘em, but that’s what this place is....",14332,https://www.reddit.com/r/wallstreetbets/comments/njizhs/when_did_this_subreddit_become_therapy/
2021-05-25,WSB presents Chad Money - ,27991,https://v.redd.it/ljq852kot3171
2021-05-26,"""So you see eventually they have to fill the shorts buy buying back the stock, it's a sure fire thing"" - ",40487,https://v.redd.it/he1qnqaspf171
2021-05-27,"Gamestop, AMC short sellers lost $754 million after Tuesday's rally - ",59841,https://finance.yahoo.com/news/gamestop-amc-short-sellers-lost-124332329.html
2021-05-28,"$10k ----> $364,000 4 trades in 3 days - ",37966,https://i.redd.it/jnsbt88bno171.jpg
2021-05-29,GME & AMC - ,15573,https://v.redd.it/wy02dtjhmw171
2021-05-30,"A little premarked hype video i put together, since stonk marked is closed and i was bored - ",30325,https://v.redd.it/13sjajl4y8271
2021-05-31,My investment vs Wall Street. - ,57664,https://v.redd.it/b8ua2w884b271
2021-06-01,Everything I touch - ,19359,https://v.redd.it/p8wvbew78i271
2021-06-10,Friendly Reminder: Inflation Rate - ,62728,https://v.redd.it/36x5mblp2e471
2021-06-11,A Quick PSA - ,23730,https://v.redd.it/69z7akk9qm471
2021-06-12,What it means to be a WSB member - ,22035,https://v.redd.it/rlhz6yo5dq471
2021-06-13,"Why you should make a WISH - I just WISH to highlight some facts from my own analysis on why I think WISH is worth a look. I used several criterias and detailed the methodology used for each one as well as the results. Enjoy the reading.

&#x200B;

**Analysts Opinion**

* *Methodology*: Comparing th...",159,https://www.reddit.com/r/wallstreetbets/comments/ny69ns/why_you_should_make_a_wish/
2021-06-15,Still Holding my AMC calls🚀📈. They expire this Friday. Haters told me to sell week In and week out. Look at me now!! 5000%+ Gains. Let’s Go!!!!!! 💎👋🦧👋💎 - ,23149,https://i.redd.it/0v9fgi8boc571.jpg
2021-06-16,"Please join us in prayer before the Fed announcement tomorrow - As we are reminded about the ongoing Fed meeting and release of statement on wednesday, we invite you to join us in prayer to avoid drill team six from taking over the markets.

Prayer expresses our dependence on JPow, a recognition tha...",19426,https://www.reddit.com/r/wallstreetbets/comments/o0otu2/please_join_us_in_prayer_before_the_fed/
2021-06-17,Next step retirement. - ,43513,https://i.redd.it/xm9z2sksmq571.png
2021-06-18,Nice - ,46753,https://i.redd.it/jq1teziu0x571.jpg
2021-06-19,"im drunk, stocks are fake, everyone just be fucking chill and nice to each other - im drunk. its late. just scrolling around and looking at people yell at each other about fake numbers that at best are loosely tied to reality and actual material goods. y'all just be chill, its all fake. were all jus...",21126,https://www.reddit.com/r/wallstreetbets/comments/o3cj1s/im_drunk_stocks_are_fake_everyone_just_be_fucking/
2021-06-20,“So how much money have you made off all those meme stocks you bought into?” - ,28520,https://v.redd.it/2o3zxt2glb671
2021-06-21,Chad Money: Episode 5 - ,17501,https://v.redd.it/qw7qyao0ch671
2021-06-22,What’s changed for me since joining WSB. - ,32469,https://v.redd.it/6t923htsro671
2021-06-23,No way this goes tits up! Updated.. - ,44380,https://v.redd.it/xjtd7qqef0771
2021-06-24,"4MM Yolo $WISH, Caesar is home, where are my ape brothers and sisters - ",7542,https://i.redd.it/kczqu808x4771.jpg
2021-06-25,"David Portnoy called a ""paper hands"" and ""little bitch."" cut for time... - ",31761,https://v.redd.it/ng7ddfyhjc771
2021-06-26,24.6k into 150k on my very first options call! - ,6792,https://i.redd.it/v59jg5du0i771.jpg
2021-06-28,Dave & Buster's - The Power $PLAY - Gather ‘round degenerates for I have come across a value play that I would like to share with you. Do you enjoy playing arcade games and hanging out with friends? Miss the good old days of watching live sporting events on the big screen while cheering along with t...,1659,https://www.reddit.com/r/wallstreetbets/comments/o9i3ze/dave_busters_the_power_play/
2021-06-29,📉😵‍💫😵‍💫 - ,33144,https://v.redd.it/3rb9nd0fg8871
2021-06-30,A Brief Look at Me Missing Out on Every Popular Stock in the Last 3 Months - ,6603,https://v.redd.it/zxb5thx7v9871
2021-07-01,WSB dad finds his kid's trading account - ,31528,https://v.redd.it/pnb6y6dwme871
2021-07-02,A bet is a bet... Call this one fulfilled! - ,54667,https://v.redd.it/mm6osr6sbq871
2021-07-03,Guh - ,37746,https://i.redd.it/p5wv8w399w871.jpg
2021-07-04,"BofA initiates legal proceedings against WSB and Reddit Inc. - #BOFA DEEZ NUTS

Big thanks to all the approved users who kept this joke under wraps in [the original thread](https://old.reddit.com/r/wallstreetbets/comments/od2085/bofa_initiates_legal_proceedings_against_wsb_and/)",24258,https://www.reddit.com/r/wallstreetbets/comments/od4b09/bofa_initiates_legal_proceedings_against_wsb_and/
2021-07-05,"""Its a gambling parlor masquerading as a business"" - ",20153,https://v.redd.it/rsnvwlbxve971
2021-07-06,"Let me clear the air here regarding GME, AMC, & CLOV - Alright you retards, I'm taking the initiative to clear the air. I'm probably going to get a lot of downvotes, but I'm going to be straight up honest here.

We are not a team, this is not a cult, and this is not fucking collusion.

GME, AMC, & C...",14803,https://www.reddit.com/r/wallstreetbets/comments/of0hls/let_me_clear_the_air_here_regarding_gme_amc_clov/
2021-07-07,Did I do this right? - ,2285,https://i.redd.it/bl5br1y39s971.jpg
2021-07-08,Yolo lmao - ,18783,https://i.redd.it/w3xvnchors971.jpg
2021-07-09,💎🙌🏻 - ,39250,https://i.redd.it/zkb2000xm0a71.jpg
2021-07-10,"$90 > $24,000 in one day. - ",34601,https://www.reddit.com/gallery/ogym6z
2021-07-11,My 2021 Experience - ,12695,https://v.redd.it/pf9ct41qgja71
2021-07-12,"Live feed from the flight , spce to the fucken MOON - ",17796,https://v.redd.it/a0bunhurxma71
2021-07-13,When 4000 calls start printing... Jeffrey Jeffrey Bezos 🎵 - ,20325,https://v.redd.it/9xsf2wjf8sa71
2021-07-14,It’s only Tuesday - ,27882,https://i.redd.it/1gexktg0p1b71.jpg
2021-07-15,A foolproof strategy - ,26052,https://i.redd.it/np6dra9wt6b71.png
2021-07-16,My WSB experience so far - ,37905,https://v.redd.it/s60y0zax3fb71
2021-07-17,"Zillow is aiming to kill real estate agents - Six fucking percent for a week of work.  That's what realtors want in this market.  3% for the buyer's agent, 3% for the seller's agent, and all they have to do is take some pictures and put that shit up on the internet.  It's galling.  You have a $500k ...",24573,https://www.reddit.com/r/wallstreetbets/comments/olqhjh/zillow_is_aiming_to_kill_real_estate_agents/
2021-07-18,My kids are fucked. - ,17084,https://i.redd.it/c8fcc1g4svb71.jpg
2021-07-19,Found footage of teen losing trading privileges - ,21426,https://v.redd.it/3qx79rkrh5c71
2021-07-20,Flawless execution - ,5481,https://v.redd.it/wdt5k6gwx9c71
2021-08-02,My portfolio after discovering wsb - ,45436,https://v.redd.it/s1xhc17euye71
2021-08-03,Unpopular opinion: Robinhood still has the best mobile interface - Robinhood fucked me on GME and i moved all of my funds to Webull but im not liking the webull mobile app as much as Robinhood. (TD Ameritrade also stopped buys on GME but i didnt have an option to move my self directed HSA account ou...,4829,https://www.reddit.com/r/wallstreetbets/comments/ox50iz/unpopular_opinion_robinhood_still_has_the_best/
2021-08-04,My experience trading with Robinhood this past year - ,15428,https://v.redd.it/go5d7pftpbf71
2021-08-05,Robinhood shares fall as stockholders file to sell up to 97.9 million shares - ,26720,https://www.cnbc.com/2021/08/05/robinhood-shares-fall-as-stockholders-file-to-sell-up-to-97point9-million-shares-over-time.html
2021-08-06,"I accidentally fucked up and deposited $15k into a random account - This is not a shitpost, I’ve included screenshots and will provide additional if needed by the ghey mods to show this is real.

I logged into a device’s Robinhood account (I’m from Iowa btw) and linked my bank account. Then immediat...",15648,https://www.reddit.com/r/wallstreetbets/comments/oz13mw/i_accidentally_fucked_up_and_deposited_15k_into_a/
2021-08-07,Me - ,35044,https://v.redd.it/2i5upmukxxf71
2021-08-08,Which one of you was in Grand Lake this weekend? - ,33842,https://i.redd.it/p0h31bm3z4g71.jpg
2021-08-09,Super Wallstreet Bros. Bets - ,25270,https://v.redd.it/o4qjn1vgabg71
2021-08-10,The Five D's of WSB - ,8267,https://v.redd.it/deylv0cpuig71
2021-08-11,"$14,250 in 24 minutes - ",14482,https://i.redd.it/mbi80rbxorg71.jpg
2021-08-12,Cloverboy - ,13472,https://v.redd.it/lo0kqi0rzwg71
2021-08-13,Would manny monitors help you make more or lose more money? 🤔 - ,12196,https://v.redd.it/w4lkj0upr6h71
2021-08-14,"The more monitors you have, the better the trader you are, right! - ",14247,https://i.redd.it/864ky7e8i8h71.jpg
2021-08-15,"How to become a billionaire in 5 easy steps - Step 1: Find a product that people love… then make a slightly better version of it, and price it WAY BELOW your cost so that you lose money on every unit sold.

Step 2: Create a ridiculous mission statement. It doesn’t matter what you’re selling -- your ...",14482,https://www.reddit.com/r/wallstreetbets/comments/p4y22z/how_to_become_a_billionaire_in_5_easy_steps/
2021-08-16,Watching your porfolio after a YOLO - ,305,https://v.redd.it/r7tpl1xvonh71
